{
  "$schema": "../model.schema.json",
  "id": 62,
  "name": "NK_CW09",
  "capabilities": {
    "interest": true,
    "inflation": true,
    "outputgap": true,
    "output": true,
    "mp_shock": true,
    "fiscal_shock": true,
    "rules": [
      3,
      4,
      5,
      6,
      7,
      9,
      10,
      11
    ]
  },
  "description": {
    "ac_ref": "Curdia & Woodford (2009)",
    "paper_title": "Credit frictions and optimal monetary policy",
    "journal": "BIS Working Paper No 278",
    "replicants_name": "A.HÃ¼ser and M.Kontny",
    "pub_date": "2009",
    "keywords": [],
    "description": "",
    "category": "Calibrated model",
    "authors": [
      "Curdia, Vasco",
      "Woodford, Michael"
    ]
  },
  "msr": [
    "0",
    "0",
    "0",
    "0",
    "2",
    "0",
    "0",
    "0",
    "0",
    "0",
    "0",
    "0",
    "0",
    ".25",
    "0",
    "0",
    "0",
    "0",
    "0",
    "0",
    "0",
    "0",
    "0",
    "0",
    "0",
    "0",
    "0",
    "0",
    "0",
    "0",
    "0",
    "1",
    "0.25"
  ],
  "variabledim": 1,
  "al": false
}