{
  "$schema": "../model.schema.json",
  "id": 56,
  "name": "US_VMDop",
  "capabilities": {
    "interest": true,
    "inflation": true,
    "outputgap": true,
    "output": true,
    "mp_shock": true,
    "fiscal_shock": false,
    "rules": [
      3,
      4,
      5,
      6,
      7,
      8,
      9,
      10,
      11
    ]
  },
  "description": {
    "ac_ref": "Verona et al. (2013) II",
    "paper_title": "(Un)anticipated monetary policy in a dsge model with a shadow\nbanking system - Optimistic times",
    "journal": "International Journal of Central Banking 9 (3), pp. 78-124",
    "replicants_name": "Fabio Verona",
    "pub_date": "2013",
    "keywords": [],
    "description": "Calibrated for optimistic times",
    "category": "Estimated US model",
    "authors": [
      "Verona, Fabio",
      "Martins, Manuel M. F.",
      "Drumond, Ines"
    ]
  },
  "msr": [
    "0.88",
    "0",
    "0",
    "0",
    "0",
    "0",
    "0",
    "0",
    "0",
    "(1-0.88)*1.82*1/1.0516",
    "0",
    "0",
    "0",
    "0",
    "0",
    "0",
    "0",
    "0",
    "0",
    "0",
    "0",
    "0",
    "(1-0.88)*4*0.11*0.4796/1.0516",
    "0",
    "0",
    "0",
    "0",
    "0",
    "0",
    "0",
    "0",
    "1",
    "0.25"
  ],
  "variabledim": 2,
  "al": false
}