{
  "$schema": "../model.schema.json",
  "id": 125,
  "name": "EA_PV16",
  "capabilities": {
    "interest": true,
    "inflation": true,
    "outputgap": true,
    "output": true,
    "mp_shock": true,
    "fiscal_shock": true,
    "rules": [
      3,
      4,
      5,
      6,
      7,
      8,
      9,
      10,
      11
    ]
  },
  "description": {
    "ac_ref": "Priftis & Vogel (2016)",
    "paper_title": "The Portfolio Balance Mechanism and QE in the Euro Area",
    "journal": "Manchester School, University of Manchester, vol. 84(S1), 84-105",
    "replicants_name": "original code provided by the authors",
    "pub_date": "2016",
    "keywords": [],
    "description": "",
    "category": "Estimated euro area model",
    "authors": [
      "Priftis, Romanos",
      "Vogel, Lukas"
    ]
  },
  "msr": [
    "0.82",
    "0",
    "0",
    "0",
    "0.18*1.5",
    "0",
    "0",
    "0",
    "0",
    "0",
    "0",
    "0",
    "0",
    "0.18*0.5",
    "0",
    "0",
    "0",
    "0",
    "0",
    "0",
    "0",
    "0",
    "0",
    "0",
    "0",
    "0",
    "0",
    "0",
    "0",
    "0",
    "0",
    "1",
    "0.25"
  ],
  "variabledim": 1,
  "al": false
}